,id,description,preproc_description
373,374,"Pique fleece 1/4 zip - Made from plush textured fleece, the classic Pique 1/4-Zip has raglan sleeves and wears like a favorite old sweatshirt. Great for casual wear or as an active layering piece. The 100% polyester piqu? knit fleece is soft and warm, and contrast Supplex nylon reinforces the collar for extra durability. We added a left-side zippered security pocket to keep keys and phone handy. Recyclable through the Common Threads Recycling Program.<br><br><b>Details:</b><ul> <li>""Soft, 100% polyester piqu? knit face; fleece interior""</li> <li>Supplex reinforced collar</li> <li>Left-side zippered security pocket</li></ul><br><br><b>Fabric: </b>6-oz 100% polyester fleece. Trim: Supplex 100% nylon. Recyclable through the Common Threads Recycling Program<br><br><b>Weight: </b>(346 g 12 oz)<br><br>Made in Vietnam.",pique fleece zip made plush textured fleece classic pique /-zip raglan sleeve wear like favorite old sweatshirt great casual wear active layering piece polyester piqu knit fleece soft warm contrast supplex nylon reinforces collar extra durability added left-side zippered security pocket keep key phone handy recyclable common thread recycling program.details `` soft polyester piqu knit face fleece interior '' supplex reinforced collar left-side zippered security pocketfabric -oz polyester fleece trim supplex nylon recyclable common thread recycling programweight g oz made vietnam
374,375,"Pique vitaliti polo shirt - The perfect summer fabric to keep your back from sticking to the seat. The pique polo's forward-thinking blend of 6.5-oz 70% organic cotton and 30% all-recycled polyester also wicks moisture during long walks beneath the Flatirons, highball V4s at Flagstaff and hardcore sodbusting sessions in your own back yard.<br><br><b>Details:</b><ul> <li>""Lightweight, quick-to dry organic cotton/recycled polyester fabric in a piqu? knit""</li> <li>Hidden snap-front placket</li> <li>Side vents</li></ul><br><br><b>Fabric: </b>6.5-oz 70% organic cotton/30% all-recycled polyester piqu??. Recyclable through the Common Threads Recycling Program<br><br><b>Weight: </b>(262 g 9.1 oz)<br><br>Made in Thailand.",pique vitaliti polo shirt perfect summer fabric keep back sticking seat pique polo 's forward-thinking blend .-oz organic cotton all-recycled polyester also wick moisture long walk beneath flatiron highball v flagstaff hardcore sodbusting session back yard.details `` lightweight quick-to dry organic cotton/recycled polyester fabric piqu knit '' hidden snap-front placket side ventsfabric .-oz organic cotton/ all-recycled polyester piqu recyclable common thread recycling programweight g oz made thailand
375,376,"Polo shirt - Pulling on a polo opens the door to possibilities - the look gets you past people who enforce regulations, and the feel puts plans in motion. Ours has a hefty, 7.2-oz organic cotton fabric in a piqu? knit that keeps its casual composure (and bolsters yours), even when the occasion requires a steady smile or enclosed footwear. With a soft, athletic collar and a low-profile placket for increased durability over its long life. Recyclable through the Common Threads Recycling Program.  <br><br><b>Details:</b><ul> <li>Organic cotton piqu?</li> <li>Taped neck; frame-knit collar and cuffs</li> <li>3-button placket</li> <li>Taped side vents</li></ul><br><br><b>Fabric: </b>7.2-oz 100% organic cotton piqu?. Recyclable through the Common Threads Recycling Program<br><br><b>Weight: </b>300 g (10.6 oz)<br><br>Made in China.",polo shirt pulling polo open door possibility look get past people enforce regulation feel put plan motion hefty .-oz organic cotton fabric piqu knit keep casual composure bolster even occasion requires steady smile enclosed footwear soft athletic collar low-profile placket increased durability long life recyclable common thread recycling program detail organic cotton piqu taped neck frame-knit collar cuff -button placket taped side ventsfabric .-oz organic cotton piqu recyclable common thread recycling programweight g oz made china
376,377,"Quiet please t-shirt - Thoreau said that ""silence is the universal refuge""   a sentiment made clear with the Quiet Please T-Shirt. Illustrated by the art team Heads of State, the tee has an inside message about Snowlands Network(SaveOurSnowlands.org), a group leading the charge to keep our winter wild lands serene preserving and protecting them for low-impact users. The shirt is recyclable through the Common Threads Recycling Program.<br><br><b>Details:</b><ul> <li>Ringspun yarns for a softer hand</li> <li>Taped shoulder seams</li> <li>Screen-print inks are PVC- and phthalate-free</li></ul><br><br><b>Fabric: </b>5.4-oz 100% organic cotton. Recyclable through the Common Threads Recycling Program<br><br><b>Weight: </b>(175 g 6.1 oz)<br><br>Made in USA.",quiet please t-shirt thoreau said `` silence universal refuge '' sentiment made clear quiet please t-shirt illustrated art team head state tee inside message snowlands network saveoursnowlands.org group leading charge keep winter wild land serene preserving protecting low-impact user shirt recyclable common thread recycling program.details ringspun yarn softer hand taped shoulder seam screen-print ink pvc- phthalate-freefabric .-oz organic cotton recyclable common thread recycling programweight g oz made usa
377,378,"R1 full-zip jkt - It stretches, breathes, wicks, and warms - no wonder so many serious trail and mountain athletes use and abuse our R1. And the full-zip front makes it even more versatile, from a midlayer in winter to a lightweight jacket on early spring mornings and alpine summer evenings. The high/low interior grid polyester enhances compressibility, airflow, insulation and dry time, and the jersey microfiber face allows smooth layering. Two zippered handwarmer pockets sit above the harness line and have glued-in (no seams) internal mesh pocket bags. Recyclable through the Common Threads Recycling Program.<br><br><b>Details:</b><ul> <li>""Versatile R1 fleece provides excellent stretch, warmth, wicking and breathability in a variety of temperatures""</li> <li>""High/low interior grid-structure enhances compressibility, airflow and dry time""</li> <li>Jersey microfiber face allows nonbinding layering</li> <li>Center-front zipper</li> <li>Handwarmer pockets</li></ul><br><br><b>Fabric: </b>R1: 6.5-oz Polartec Power Dry 93% polyester (60% recycled)/7% spandex. Recyclable through the Common Threads Recycling Program<br><br><b>Weight: </b>357 g (12.6 oz)<br><br>Made in Colombia.",r full-zip jkt stretch breathes wick warms wonder many serious trail mountain athlete use abuse r. full-zip front make even versatile midlayer winter lightweight jacket early spring morning alpine summer evening high/low interior grid polyester enhances compressibility airflow insulation dry time jersey microfiber face allows smooth layering two zippered handwarmer pocket sit harness line glued-in seam internal mesh pocket bag recyclable common thread recycling program.details `` versatile r fleece provides excellent stretch warmth wicking breathability variety temperature '' `` high/low interior grid-structure enhances compressibility airflow dry time '' jersey microfiber face allows nonbinding layering center-front zipper handwarmer pocketsfabric r .-oz polartec power dry polyester recycled spandex recyclable common thread recycling programweight g oz made colombia
378,379,"Lw guide pants - A backcountry version of our immensely popular Simple Guides, the Lightweight Guide Pants combine skiing and alpine climbing features with a lightweight, free-moving and highly breathable 4-way stretch-woven fabric. They resist moisture and provide mountain-worthy durability, and the fit allows for spring-weight underlayers on those brisk alpine starts. Reinforced, articulated knees enhance mobility, while the zippered and gusseted cuffs adjust to various boot girths, have a snap closure, and feature tie-down loops as well as crampon/ski edge scuff guards. With a zippered fly, belt loops and pockets (two hand, one glued-on right thigh) that close with laser-cut, glued-in zippers. Recyclable through the Common Threads Recycling Program.<br><br><b>Details:</b><ul> <li>Lightweight 4-way stretch-woven polyester double weave with DWR (durable  water repellent) finish; separated zip waist (not pull-on)</li> <li>Belt loops; partial elasticized waistband</li> <li>""Zip fly; pockets: two zippered hand, one zippered thigh, right glued-on thigh""</li> <li>Hand and thigh zips are laser-cut and glued; reinforced knees to resist abrasion</li> <li>Articulated knees; crampon/ski-edge scuff guard</li> <li>Zippered and snap gusset with full gripper elastic</li> <li>Tie-down loops at ankle cuffs</li></ul><br><br><b>Fabric: </b>6.2-oz 91% all-recycled polyester/9% spandex double weave with Deluge DWR (durable water repellent) finish. Recyclable through the Common Threads Recycling Program<br><br><b>Weight: </b>405 g (14.3 oz)<br><br>Made in Thailand.",lw guide pant backcountry version immensely popular simple guide lightweight guide pant combine skiing alpine climbing feature lightweight free-moving highly breathable -way stretch-woven fabric resist moisture provide mountain-worthy durability fit allows spring-weight underlayers brisk alpine start reinforced articulated knee enhance mobility zippered gusseted cuff adjust various boot girth snap closure feature tie-down loop well crampon/ski edge scuff guard zippered fly belt loop pocket two hand one glued-on right thigh close laser-cut glued-in zipper recyclable common thread recycling program.details lightweight -way stretch-woven polyester double weave dwr durable water repellent finish separated zip waist pull-on belt loop partial elasticized waistband `` zip fly pocket two zippered hand one zippered thigh right glued-on thigh '' hand thigh zip laser-cut glued reinforced knee resist abrasion articulated knee crampon/ski-edge scuff guard zippered snap gusset full gripper elastic tie-down loop ankle cuffsfabric .-oz all-recycled polyester/ spandex double weave deluge dwr durable water repellent finish recyclable common thread recycling programweight g oz made thailand
379,380,"Lw r4 jkt - High off the deck on Warbonnet Peak in the immaculate Wind River Mountains, the naming of the range quickly makes sense. Our windproof and stretchy Lightweight R4 Jacket protects and warms with a Polartec Windbloc laminate sandwiched between a low-nap polyester microfleece face and a high/low grid polyester interior. Unlaminated R1 underarm panels (60% recycled polyester) enhance breathability and mobility, while a neck gasket seals out the elements. Seamless shoulders allow pack-wearing comfort. With three external pockets (the handwarmers stay clear of your harness), one internal drop-in pocket and a drawcord hem. Recyclable through the Common Threads Recycling Program.<br><br><b>Details:</b><ul> <li>""Lightweight, durable low-nap microfleece face""</li> <li>Full-stretch Polartec Windbloc laminate</li> <li>R1 interior-grid construction speeds wicking</li> <li>Nonlaminated R1 fabric under the arms enhances mobility and breathability</li> <li>Drawcord collar with Supplex stand; protective chin flap for comfort; seamless shoulders for comfort under a pack</li> <li>""Pockets: two handwarmers, one chest and two internal drop-in""</li> <li>Drawcord hem</li></ul><br><br><b>Fabric: </b>Lightweight R4 shell: 8-oz Polartec Windbloc 100% polyester microfleece laminated to R1 Polartec Power Dry polyester. R1 panels: 6.5-oz Polartec Power Dry 93% polyester (60% recycled)/7% spandex. Recyclable through the Common Threads Recycling Program<br><br><b>Weight: </b>467 g (16.5 oz)<br><br>Made in Colombia.",lw r jkt high deck warbonnet peak immaculate wind river mountain naming range quickly make sense windproof stretchy lightweight r jacket protects warms polartec windbloc laminate sandwiched low-nap polyester microfleece face high/low grid polyester interior unlaminated r underarm panel recycled polyester enhance breathability mobility neck gasket seal element seamless shoulder allow pack-wearing comfort three external pocket handwarmers stay clear harness one internal drop-in pocket drawcord hem recyclable common thread recycling program.details `` lightweight durable low-nap microfleece face '' full-stretch polartec windbloc laminate r interior-grid construction speed wicking nonlaminated r fabric arm enhances mobility breathability drawcord collar supplex stand protective chin flap comfort seamless shoulder comfort pack `` pocket two handwarmers one chest two internal drop-in '' drawcord hemfabric lightweight r shell -oz polartec windbloc polyester microfleece laminated r polartec power dry polyester r panel .-oz polartec power dry polyester recycled spandex recyclable common thread recycling programweight g oz made colombia
380,381,"R2 jkt - A modern mountain staple, the adaptable R2 Jacket serves as a stand-alone outer layer when you're on the go or as a superb insulating layer under a shell. The stretchy polyester knit uses variable-length fibers to optimize insulation and compressibility while affording outstanding breathability, warmth, moisture-management and minimal weight. Stretchy R1 fabric (made with 60% recycled polyester) inside the collar and cuffs enhances skin comfort, and the pliable R2 body fabric means you'll move easily. With an easy-to-use front zipper, glued-in zippered pockets (one chest and two handwarmers) and forward-set shoulder seams for pack-wearing comfort. Recyclable through the Common Threads Recycling Program.<br><br><b>Details:</b><ul> <li>""Highly technical R2 fabric is light, stretchy and compressible, with great breathability""</li> <li>""Insulating long fibers alternate with dense, supportive short fibers to optimize insulation and reduce bulk""</li> <li>Directional knit wicks moisture and speeds dry time</li> <li>Inner collar lined with R1 fabric (made with recycled polyester) for next-to-skin comfort; collar and protective chin flap lined with R1 fabric (made with recycled polyester) for next-to-skin comfort</li> <li>Low-bulk R1 fabric cuffs</li> <li>Pockets: one chest and zippered handwarmers; zippers all welded and reinforced with Supplex for snag-free operation</li> <li>Shoulder seams set forward for pack-wearing comfort</li></ul><br><br><b>Fabric: </b>R2 shell: 7.4-oz Polartec Thermal Pro 100% polyester (40% recycled) fleece. R1 panels: 6.5-oz Polartec Power Dry 93% polyester (60% recycled)/7% spandex. Recyclable through the Common Threads Recycling Program<br><br><b>Weight: </b>419 g (14.8 oz)<br><br>Made in Colombia.",r jkt modern mountain staple adaptable r jacket serf stand-alone outer layer 're go superb insulating layer shell stretchy polyester knit us variable-length fiber optimize insulation compressibility affording outstanding breathability warmth moisture-management minimal weight stretchy r fabric made recycled polyester inside collar cuff enhances skin comfort pliable r body fabric mean 'll move easily easy-to-use front zipper glued-in zippered pocket one chest two handwarmers forward-set shoulder seam pack-wearing comfort recyclable common thread recycling program.details `` highly technical r fabric light stretchy compressible great breathability '' `` insulating long fiber alternate dense supportive short fiber optimize insulation reduce bulk '' directional knit wick moisture speed dry time inner collar lined r fabric made recycled polyester next-to-skin comfort collar protective chin flap lined r fabric made recycled polyester next-to-skin comfort low-bulk r fabric cuff pocket one chest zippered handwarmers zipper welded reinforced supplex snag-free operation shoulder seam set forward pack-wearing comfortfabric r shell .-oz polartec thermal pro polyester recycled fleece r panel .-oz polartec power dry polyester recycled spandex recyclable common thread recycling programweight g oz made colombia
381,382,"Rain shadow jkt - Staying inside isn't the only way to stay dry - enjoy the trails in all conditions with fully seam-sealed waterproof/breathable protection. The Rain Shadow is made from a packable, lightweight and tear-resistant 2.5-layer 100% nylon fabric with a waterproof/breathable H2No barrier and a Deluge DWR (durable water repellent) finish. On the inside, a raised pattern diffuses and channels moisture away from skin, aids in hassle-free layering, and enhances long-term durability. Updated with microfleece lining on the neck and chin, waterproof handwarmer pockets (no longer mesh-lined) with zipper garages, and external zippers that are now water-resistant (without storm flaps). Also features a roll-down, 2-way-adjustable, helmet-compatible hood, a 2-way center-front zipper, self-fabric cuff tabs and a drawcord hem.<br><br><b>Details:</b><ul> <li>""2.5-layer tear-resistant fabric with a waterproof/breathable H2No barrier and a Deluge DWR (durable water repellent) finish; highly engineered interior surface texture channels moisture away from skin, protects the waterproof barrier from abrasion and slides easily over layers""</li> <li>""Roll-down, 2-way-adjustable hood with a laminated visor for improved hood structure and visibility in poor conditions""</li> <li>Microfleece-lined neck and chin for comfort and enhanced protection of barrier</li> <li>""All exterior zippers (center front, handwarmer pockets and pit zips) have a water-resistant  coating to keep you dry without extra storm flaps and hook-and-loop closures""</li> <li>Waterproof handwarmer pockets - without mesh lining</li> <li>Updated custom zipper pulls</li> <li>""Low-profile, laminated self-fabric cuff tabs; drawcord hem""</li></ul><br><br><b>Fabric: </b>""2.5-layer, 2.5-oz 100% nylon with a waterproof/breathable H2No barrier and Deluge DWR finish""<br><br><b>Weight: </b>(331 g 11.5 oz)<br><br>Made in Vietnam.",rain shadow jkt staying inside n't way stay dry enjoy trail condition fully seam-sealed waterproof/breathable protection rain shadow made packable lightweight tear-resistant .-layer nylon fabric waterproof/breathable hno barrier deluge dwr durable water repellent finish inside raised pattern diffuses channel moisture away skin aid hassle-free layering enhances long-term durability updated microfleece lining neck chin waterproof handwarmer pocket longer mesh-lined zipper garage external zipper water-resistant without storm flap also feature roll-down -way-adjustable helmet-compatible hood -way center-front zipper self-fabric cuff tab drawcord hem.details `` .-layer tear-resistant fabric waterproof/breathable hno barrier deluge dwr durable water repellent finish highly engineered interior surface texture channel moisture away skin protects waterproof barrier abrasion slide easily layer '' `` roll-down -way-adjustable hood laminated visor improved hood structure visibility poor condition '' microfleece-lined neck chin comfort enhanced protection barrier `` exterior zipper center front handwarmer pocket pit zip water-resistant coating keep dry without extra storm flap hook-and-loop closure '' waterproof handwarmer pocket without mesh lining updated custom zipper pull `` low-profile laminated self-fabric cuff tab drawcord hem '' fabric `` .-layer .-oz nylon waterproof/breathable hno barrier deluge dwr finish '' weight g oz made vietnam
382,383,"Lw everyday socks - An essential part of the daily grind, these exceptionally soft, wearable socks have an inviting mix of 55% organic cotton/40% stretch nylon/5% spandex for moisture-wicking next-to-skin comfort. An open grid over the top of the foot and a looped Lintoe construction combine to create excellent airflow for breathability and kick-your-feet-up foot comfort. The jersey-knit cuff extends to mid-calf; height is 9.5"".<br><br><b>Details:</b><ul> <li>Organic cotton and nylon blend is ideal for everyday use</li> <li>""Fabric content and strategic knit balance moisture wicking, cushioning, durability and comfort""</li> <li>An open grid over top of foot allows excellent airflow and breathability</li> <li>Looped Lintoe construction creates the smallest and flattest seam possible for ultimate toe comfort</li></ul><br><br><b>Fabric: </b>55% organic cotton/40% nylon/5% spandex<br><br><b>Weight: </b>(49 g 1.7 oz)<br><br>Made in USA.",lw everyday sock essential part daily grind exceptionally soft wearable sock inviting mix organic cotton/ stretch nylon/ spandex moisture-wicking next-to-skin comfort open grid top foot looped lintoe construction combine create excellent airflow breathability kick-your-feet-up foot comfort jersey-knit cuff extends mid-calf height `` .details organic cotton nylon blend ideal everyday use `` fabric content strategic knit balance moisture wicking cushioning durability comfort '' open grid top foot allows excellent airflow breathability looped lintoe construction creates smallest flattest seam possible ultimate toe comfortfabric organic cotton/ nylon/ spandexweight g oz made usa
383,384,"Lw guide pants - A backcountry version of our immensely popular Simple Guides, the Lightweight Guide Pants combine skiing and alpine climbing features with a lightweight, free-moving and highly breathable 4-way stretch-woven fabric. They resist moisture and provide mountain-worthy durability, and the fit allows for spring-weight underlayers on those brisk alpine starts. The gusseted crotch and reinforced, articulated knees allow unrestrained mobility, while the zippered and gusseted cuffs adjust to various boot girths, have a snap closure, and feature tie-down loops as well as crampon/ski edge scuff guards. With a 2-way zip fly, belt loops and pockets (two hand, one glued-on right thigh) that close with laser-cut, glued-in zippers. Recyclable through the Common Threads Recycling Program.<br><br><b>Details:</b><ul> <li>Lightweight 4-way stretch-woven polyester double weave with DWR (durable water repellent) finish; gusseted crotch</li> <li>Separated zip waist (not pull-on); Belt loops</li> <li>""2-way zip fly; pockets: two zippered handwarmers, one zippered thigh, right glued-on thigh""</li> <li>Zippers: hand and thigh are laser cut and glued</li> <li>Reinforced knees to resist abrasion; articulated knees</li> <li>Crampon/ski-edge scuff guard; zippered and snap gusset with full gripper elastic</li> <li>Tie-down loops at ankle cuffs</li></ul><br><br><b>Fabric: </b>6.2-oz 91% all-recycled polyester/9% spandex double weave with Deluge DWR (durable water repellent) finish. Recyclable through the Common Threads Recycling Program<br><br><b>Weight: </b>439 g (15.5 oz)<br><br>Made in Thailand.",lw guide pant backcountry version immensely popular simple guide lightweight guide pant combine skiing alpine climbing feature lightweight free-moving highly breathable -way stretch-woven fabric resist moisture provide mountain-worthy durability fit allows spring-weight underlayers brisk alpine start gusseted crotch reinforced articulated knee allow unrestrained mobility zippered gusseted cuff adjust various boot girth snap closure feature tie-down loop well crampon/ski edge scuff guard -way zip fly belt loop pocket two hand one glued-on right thigh close laser-cut glued-in zipper recyclable common thread recycling program.details lightweight -way stretch-woven polyester double weave dwr durable water repellent finish gusseted crotch separated zip waist pull-on belt loop `` -way zip fly pocket two zippered handwarmers one zippered thigh right glued-on thigh '' zipper hand thigh laser cut glued reinforced knee resist abrasion articulated knee crampon/ski-edge scuff guard zippered snap gusset full gripper elastic tie-down loop ankle cuffsfabric .-oz all-recycled polyester/ spandex double weave deluge dwr durable water repellent finish recyclable common thread recycling programweight g oz made thailand
384,385,"Lw hiking crew liner socks - Liners take the brunt of our rambles. They add lightweight warmth in cold conditions, reduce chafing when paired with a sock, and keep feet dry and cool when worn solo in sweltering weather. Made from a jersey-knit construction of 60% polyester (100% recycled) with 37% nylon for superior moisture transport, quick-drying performance and absolute durability; 3% spandex provides shape retention and give; looped Lintoe construction provides added comfort. Height is 9.5"".<br><br><b>Details:</b><ul> <li>Lightweight polyester and nylon blend strategically knit for excellent wicking and a speedy dry time</li> <li>Looped Lintoe construction creates the smallest and flattest seam possible for ultimate toe comfort</li></ul><br><br><b>Fabric: </b>60% all-recycled polyester/37% nylon/3% spandex<br><br><b>Weight: </b>(40 g 1.4 oz)<br><br>Made in USA.",lw hiking crew liner sock liner take brunt ramble add lightweight warmth cold condition reduce chafing paired sock keep foot dry cool worn solo sweltering weather made jersey-knit construction polyester recycled nylon superior moisture transport quick-drying performance absolute durability spandex provides shape retention give looped lintoe construction provides added comfort height `` .details lightweight polyester nylon blend strategically knit excellent wicking speedy dry time looped lintoe construction creates smallest flattest seam possible ultimate toe comfortfabric all-recycled polyester/ nylon/ spandexweight g oz made usa
