,id,description,preproc_description
128,129,"Sst jkt - Bristol Bay, Tierra del Fuego, the Russian Arctic - they all share three things: good fishing, bad weather and a whole lot of SST Jackets. Since its introduction, the venerable SST has continually set the standard for on-the-water weather protection. Today's version features our latest advances in shell design and technology, along with a host of new, angler-friendly details. Now made from our new 3-layer recyclable nylon ripstop waterproof/breathable fabric, the new SST is durable, extremely light, and better yet, fully recyclable. There's also a new integrated hood with single-pull adjustment and waterproof, corrosion-resistant Aquazip main and hand pocket zippers. The now-classic large, gusseted chest pockets are waterproof and set high for deep wading. Streamlined cuffs lie flat, resist line snagging and seal out water. More details: Large back pocket and hidden rod holder. Medium length (2 inches longer than the Deep Wading Jacket). Recyclable through our Common Threads Recycling Program.<br><br><b>Details:</b><ul> <li>""Light, highly breathable and durable 3-layer recyclable nylon double ripstop fabric with a waterproof/breathable H2No barrier and a Deluge DWR (durable water repellent) finish; integrated hood with single-pull adjustment""</li> <li>""Waterproof, corrosion resistant ririAQUAzip main and handwarmer pocket zippers; reversed StretchCoat cuff fabric""</li> <li>""Large gusseted chest pockets are waterproof (set high for wading, with inside tippet pockets, large back pocket)""</li> <li>""Two Beastie D-rings on front, one on back""</li> <li>Hidden rod holder</li> <li>Y-Joint sleeves and anatomically curved elbows</li> <li>All seams are sealed</li></ul><br><br><b>Fabric: </b>""3-layer, recyclable 100% nylon double ripstop fabric with a waterproof/breathable H2No barrier and a Deluge DWR finish. Cuffs: Reverse StretchCoat. Recyclable through the Common Threads Recycling Program""<br><br><b>Weight: </b>(462 g 16.03 oz)<br><br>Made in Vietnam.",sst jkt bristol bay tierra del fuego russian arctic share three thing good fishing bad weather whole lot sst jacket since introduction venerable sst continually set standard on-the-water weather protection today 's version feature latest advance shell design technology along host new angler-friendly detail made new -layer recyclable nylon ripstop waterproof/breathable fabric new sst durable extremely light better yet fully recyclable 's also new integrated hood single-pull adjustment waterproof corrosion-resistant aquazip main hand pocket zipper now-classic large gusseted chest pocket waterproof set high deep wading streamlined cuff lie flat resist line snagging seal water detail large back pocket hidden rod holder medium length inch longer deep wading jacket recyclable common thread recycling program.details `` light highly breathable durable -layer recyclable nylon double ripstop fabric waterproof/breathable hno barrier deluge dwr durable water repellent finish integrated hood single-pull adjustment '' `` waterproof corrosion resistant ririaquazip main handwarmer pocket zipper reversed stretchcoat cuff fabric '' `` large gusseted chest pocket waterproof set high wading inside tippet pocket large back pocket '' `` two beastie d-rings front one back '' hidden rod holder y-joint sleeve anatomically curved elbow seam sealedfabric `` -layer recyclable nylon double ripstop fabric waterproof/breathable hno barrier deluge dwr finish cuff reverse stretchcoat recyclable common thread recycling program '' weight g oz made vietnam
129,130,"Stormfront duffel 100 - Designed to haul the goods, protect them and keep them dry, the Stormfront Duffel 100 is built with the most abrasion-resistant materials available and guaranteed waterproof to depths of 6 feet. Welded seams and a waterproof zipper keep water out, while TPU coatings and double-layer construction ensure durability during years of hardcore use. The duffel features top-load access for easy packing and keeps you organized with an external zip pocket and an internal mesh pocket for smaller essentials. The grab-and-toss haul handles and shoulder strap make life easier as do the removable compression straps that reverse for hauling.<br><br><b>Details:</b><ul> <li>Top load access for easy packing; external organizer zip pocket is great for quick-grab items</li> <li>Internal mesh pocket organizes the finer essentials</li> <li>Welded seams and waterproof zipper keep water out</li> <li>Grab and toss haul handles</li> <li>""Removable compression straps protect zipper, reverse for hauling and can be used for attaching larger items""</li> <li>Removable shoulder straps for comfortable long-haul carry</li> <li>Made with the most waterproof materials available with TPU coatings and double-layer construction for guaranteed durability during years of hardcore use</li></ul><br><br><b>Fabric: </b>1200-denier 100% all-recycled polyester with polyurethane coating/1000-denier polyester TPU laminate<br><br><b>Weight: </b>(1327 g 46 oz)<br><br>Made in China.",stormfront duffel designed haul good protect keep dry stormfront duffel built abrasion-resistant material available guaranteed waterproof depth foot welded seam waterproof zipper keep water tpu coating double-layer construction ensure durability year hardcore use duffel feature top-load access easy packing keep organized external zip pocket internal mesh pocket smaller essential grab-and-toss haul handle shoulder strap make life easier removable compression strap reverse hauling.details top load access easy packing external organizer zip pocket great quick-grab item internal mesh pocket organizes finer essential welded seam waterproof zipper keep water grab toss haul handle `` removable compression strap protect zipper reverse hauling used attaching larger item '' removable shoulder strap comfortable long-haul carry made waterproof material available tpu coating double-layer construction guaranteed durability year hardcore usefabric -denier all-recycled polyester polyurethane coating/-denier polyester tpu laminateweight g oz made china
130,131,"Stormfront pack - Wade a little too deep? Take one over the bow? Twelve hours of horizontal downpour? No problema. Whatever you need to keep dry, is. As long as it's safely inside the Stormfront Pack. This ultra-simple waterproof pack is now made with an even tougher, 840-denier double polyurethane-coated nylon fabric and features a revolutionary easy-to-use waterproof zipper and internal, custom-fit padded gear case with hook-and-loop dividers. It's comfortably supported by a removable shoulder-strap harness and 3D spacer-mesh back panel. Take the harness off and you have the perfect dry boat bag. An glued in zippered mesh pocket keeps valuables organized and extra dry, while the external mesh pocket holds your hydration reservoir. The harness system includes tool attachment and storage capabilities plus, as an added bonus, it's compatible with the vest portion of our Pack Vest.<br><br><b>Details:</b><ul> <li>Waterproof/corrosion-proof main zipper; zipper relocated to create a panel opening; waterproof welded pod</li> <li>Internal custom-fit padded gear case has hook-and-loop dividers</li> <li>Detachable harness transforms Stormfront Pack into a drybag</li> <li>Stormfront pack harness has some crossover functionality with our Pack Vest</li> <li>External mesh hydration reservoir pocket</li> <li>Internal zippered mesh pocket</li> <li>""3-D spacer-mesh back panel wicks moisture, dries quickly and allows air circulation""</li></ul><br><br><b>Fabric: </b>840-denier nylon double-coat with a polyurethane film. Padded gear case: 200-denier polyester. Harness pack: 3D spacer mesh<br><br><b>Weight: </b>(1125 g 39 oz)<br><br>Made in China.",stormfront pack wade little deep take one bow twelve hour horizontal downpour problema whatever need keep dry long 's safely inside stormfront pack ultra-simple waterproof pack made even tougher -denier double polyurethane-coated nylon fabric feature revolutionary easy-to-use waterproof zipper internal custom-fit padded gear case hook-and-loop divider 's comfortably supported removable shoulder-strap harness spacer-mesh back panel take harness perfect dry boat bag glued zippered mesh pocket keep valuable organized extra dry external mesh pocket hold hydration reservoir harness system includes tool attachment storage capability plus added bonus 's compatible vest portion pack vest.details waterproof/corrosion-proof main zipper zipper relocated create panel opening waterproof welded pod internal custom-fit padded gear case hook-and-loop divider detachable harness transforms stormfront pack drybag stormfront pack harness crossover functionality pack vest external mesh hydration reservoir pocket internal zippered mesh pocket `` -d spacer-mesh back panel wick moisture dry quickly allows air circulation '' fabric -denier nylon double-coat polyurethane film padded gear case -denier polyester harness pack spacer meshweight g oz made china
131,132,"Stretch polo - Core to the nomadic lifestyle, our Stretch Polo is stuffable, sink-washable and quick-drying. Throw this polo shirt in a duffel, wear it at the crag or pair it with khakis for dinner. The plaited fabric combination of 55% organic cotton/35% polyester/10% spandex has a soft, indulgent exterior with a moisture-managing interior that keeps you dry. The supple collar protects your neck from determined gearslings. Recyclable through the Common Threads Recycling Program.<br><br><b>Details:</b><ul> <li>Plaited fabric has a soft cotton exterior with polyester on the inside to wick moisture away from skin</li></ul><br><br><b>Fabric: </b>5.7-oz 55% organic cotton/35% polyester/10% spandex. Recyclable through the Common Threads Recycling Program<br><br><b>Weight: </b>(199 g 6.9 oz)<br><br>Made in Thailand.",stretch polo core nomadic lifestyle stretch polo stuffable sink-washable quick-drying throw polo shirt duffel wear crag pair khaki dinner plaited fabric combination organic cotton/ polyester/ spandex soft indulgent exterior moisture-managing interior keep dry supple collar protects neck determined gearslings recyclable common thread recycling program.details plaited fabric soft cotton exterior polyester inside wick moisture away skinfabric .-oz organic cotton/ polyester/ spandex recyclable common thread recycling programweight g oz made thailand
132,133,"Stretch wading belt - This is the belt that comes with all Patagonia Waders, made from 1 1/2"""" wide elasticized polyester, and now featuring the low-profile Duraflex Stealth-V buckle for quick release, smooth function and easy adjustment. This belt accommodates multiple tool holsters and works on any waders. The Patagonia label also doubles as an accessory loop.<br><br><b>Details:</b><ul> <li>""1 1/2"""" wide polyester elastic""</li> <li>""Quick-release DuraFlex Stealth-V buckle provides smooth function and an easy, adjustable fit""</li> <li>Patagonia label doubles as an accessory loop</li></ul><br><br><b>Fabric: </b>100% stretch polyester<br><br><b>Weight: </b>(80 g 2.8 oz)<br><br>Made in China.",stretch wading belt belt come patagonia wader made '' '' wide elasticized polyester featuring low-profile duraflex stealth-v buckle quick release smooth function easy adjustment belt accommodates multiple tool holster work wader patagonia label also double accessory loop.details `` '' '' wide polyester elastic '' `` quick-release duraflex stealth-v buckle provides smooth function easy adjustable fit '' patagonia label double accessory loopfabric stretch polyesterweight g oz made china
133,134,"Sub divider - Just as tough and water resistant as the Great Divider, the Sub is a compact, soft-sided boat chest that protects, hauls and organizes vital gear. Reels, fly boxes, phone, flares or lunch all reside safely within its protective custody when water-borne chaos rains down. Made from 840-denier double-polyurethane-coated nylon and patented molded top and bottom pans for waterproof protection even in standing water (up to the zipper). Welded seams eliminate leakage. Shock-absorbing high-density foam gives the bag shape. Inside, an adjustable foam divider, floating transparent panel and removable end pocket provide flexible organization. Access is through a highly water-resistant zipper with t-grip. Single, adjustable, removable, padded shoulder strap makes hauling easy. Insides can be removed and bag can be packed flat inside your luggage, then easily assembled when you reach your destination.<br><br><b>Details:</b><ul> <li>""Durable, waterproof, coated nylon exterior repels water; pliable, resilient high-density foam main compartment gives bag shape and protects contents""</li> <li>Patented molded top and bottom pan repels standing water and grips slippery surfaces; transparent floating interior panel (on the inside lid) has zippered pockets on both sides</li> <li>Foam divider (with hook-and-loop attachments) can be arranged in any configuration</li> <li>""One interior, zippered, transparent, removable end pocket""</li> <li>Strap attachments and seams are welded to eliminate leakage</li> <li>Highly water-resistant zipper with t-grip</li> <li>""Single, adjustable, removable, padded shoulder strap""</li></ul><br><br><b>Fabric: </b>""Body: 840-denier nylon double-coat with polyurethane coating. Top and bottom: Patented, molded, one piece TPU""<br><br><b>Weight: </b>(1324 g 45.9 oz)<br><br>Made in China.",sub divider tough water resistant great divider sub compact soft-sided boat chest protects haul organizes vital gear reel fly box phone flare lunch reside safely within protective custody water-borne chaos rain made -denier double-polyurethane-coated nylon patented molded top bottom pan waterproof protection even standing water zipper welded seam eliminate leakage shock-absorbing high-density foam give bag shape inside adjustable foam divider floating transparent panel removable end pocket provide flexible organization access highly water-resistant zipper t-grip single adjustable removable padded shoulder strap make hauling easy inside removed bag packed flat inside luggage easily assembled reach destination.details `` durable waterproof coated nylon exterior repels water pliable resilient high-density foam main compartment give bag shape protects content '' patented molded top bottom pan repels standing water grip slippery surface transparent floating interior panel inside lid zippered pocket side foam divider hook-and-loop attachment arranged configuration `` one interior zippered transparent removable end pocket '' strap attachment seam welded eliminate leakage highly water-resistant zipper t-grip `` single adjustable removable padded shoulder strap '' fabric `` body -denier nylon double-coat polyurethane coating top bottom patented molded one piece tpu '' weight g oz made china
134,135,"Surf brim - Whether you're paddling back out or waiting on the next set, our Surf Brim keeps your cranium cool and your eyes shaded. It is a quick-drying, secure hat with full-coverage protection. The 360-degree floatable foam brim shades vulnerable skin and allows clean duck dives; the dark underside reduces glare. Fast-drying 100% nylon with a DWR (durable water repellent) finish and two drain holes shed water. Stay-put details include a soft neoprene headband, a tuck-away chin strap and an adjustable rear buckle.<br><br><b>Details:</b><ul> <li>""Made from soft, fast-drying, easy-care nylon; sun-blocking foam brim holds its shape""</li> <li>Stiffer brim in front where you need it; still allows for clean duck dives</li> <li>Neoprene headband provides a secure fit; soft neoprene chin strap tucks away when not in use</li> <li>Dark underbill reduces glare; two vent/drain holes reduce water and heat build-up</li> <li>Adjustable rear buckle with elastic for snug fit</li></ul><br><br><b>Fabric: </b>Shell and underbill: 4.3-oz 100% nylon with a DWR (durable water repellent) finish. Chin strap and headband: 1-mm neoprene<br><br><b>Weight: </b>(80 g 2.8 oz)<br><br>Made in China.",surf brim whether 're paddling back waiting next set surf brim keep cranium cool eye shaded quick-drying secure hat full-coverage protection -degree floatable foam brim shade vulnerable skin allows clean duck dive dark underside reduces glare fast-drying nylon dwr durable water repellent finish two drain hole shed water stay-put detail include soft neoprene headband tuck-away chin strap adjustable rear buckle.details `` made soft fast-drying easy-care nylon sun-blocking foam brim hold shape '' stiffer brim front need still allows clean duck dive neoprene headband provides secure fit soft neoprene chin strap tuck away use dark underbill reduces glare two vent/drain hole reduce water heat build-up adjustable rear buckle elastic snug fitfabric shell underbill .-oz nylon dwr durable water repellent finish chin strap headband -mm neopreneweight g oz made china
135,136,"Surf sneaker - The footwear of choice for chasing the beach blitz, poling canoes or in some cases, sprucing up for a wedding. The Surf Sneaker employs the same tried-and-true cupped midsole and tough outsole as the Marlwalker, but has a softer flex pattern for more give on boat decks and shore breaks. Light, comfortable and fast-drying, this style offers just the right amount of support and protection without weighing you down. Our high-filtration mesh uses 100% recycled polyester. Colors selected for optimal camouflage. Nonmarking sole and wide last.<br><br><b>Details:</b><ul> <li>""Tough, durable, quick-drying synthetic leather won't fade in the sun; Neoprene collar and high-filtration mesh keeps out sand and silt; and drains quickly""</li> <li>""Molded rubber cupsole, EVA midsole and padded gel insole with arch support; softer midsole flex pattern for stability on rocking boat decks or rugged shore breaks""</li> <li>Wide last accommodates Lightweight Capilene Socks or Insulator Socks with Gravel Guard</li> <li>Sturdy rubber toe-box and molded heel counter protects against impact and sharp coral</li> <li>Padded ankle support with open laces and one top speed-lace hook</li> <li>High-traction rubber sole is nonmarking and sheds mud</li> <li>Camouflage colors</li></ul><br><br><b>Fabric: </b>""Lightweight, high-filtration all-recycled polyester mesh with synthetic leather upper and neoprene/spandex in tongue and collar. Molded, full-length cupped rubber outsole with interior EVA midsole""<br><br><b>Weight: </b>(1027 g 35.6 oz)<br><br>Made in China.",surf sneaker footwear choice chasing beach blitz poling canoe case sprucing wedding surf sneaker employ tried-and-true cupped midsole tough outsole marlwalker softer flex pattern give boat deck shore break light comfortable fast-drying style offer right amount support protection without weighing high-filtration mesh us recycled polyester color selected optimal camouflage nonmarking sole wide last.details `` tough durable quick-drying synthetic leather wo n't fade sun neoprene collar high-filtration mesh keep sand silt drain quickly '' `` molded rubber cupsole eva midsole padded gel insole arch support softer midsole flex pattern stability rocking boat deck rugged shore break '' wide last accommodates lightweight capilene sock insulator sock gravel guard sturdy rubber toe-box molded heel counter protects impact sharp coral padded ankle support open lace one top speed-lace hook high-traction rubber sole nonmarking shed mud camouflage colorsfabric `` lightweight high-filtration all-recycled polyester mesh synthetic leather upper neoprene/spandex tongue collar molded full-length cupped rubber outsole interior eva midsole '' weight g oz made china
136,137,"Tech web belt - This one's for the big jobs: hoisting heavy work pants, resisting migration under a hipbelt and most importantly, keeping everything in place during animated air-guitar routines. The belt's aluminum buckle is lightweight and strong and cinches tight for a reliable hitch; it's also handy as a bottle opener at the end of a hot day. The 1 1/2"" nylon webbing endures abuse and dries quickly.<br><br><b>Details:</b><ul> <li>Quick-dry nylon webbing doubles as emergency lash strap</li> <li>Forged aluminum buckle is lightweight and strong; notched for prying the top off a cold one</li></ul><br><br><b>Fabric: </b>""1 1/2"""" nylon webbing""<br><br><b>Weight: </b>127 g (4.5 oz)<br><br>Made in Philippines.",tech web belt one 's big job hoisting heavy work pant resisting migration hipbelt importantly keeping everything place animated air-guitar routine belt 's aluminum buckle lightweight strong cinch tight reliable hitch 's also handy bottle opener end hot day '' nylon webbing endures abuse dry quickly.details quick-dry nylon webbing double emergency lash strap forged aluminum buckle lightweight strong notched prying top cold onefabric `` '' '' nylon webbing '' weight g oz made philippine
137,138,"Text logo t-shirt - The Text Logo T-Shirt tells the classic story with one word. Printed on pure, 100% organic cotton with PVC- and phthalate-free inks, the shirt is ringspun for softness. Durable, taped shoulder seams minimize chafing. Recyclable through the Common Threads Recycling Program.<br><br><b>Details:</b><ul> <li>Ringspun yarns for a softer hand</li> <li>Taped shoulder seams</li> <li>Screen-print inks are PVC- and phthalate-free</li></ul><br><br><b>Fabric: </b>5.4-oz 100% organic cotton. Recyclable through the Common Threads Recycling Program<br><br><b>Weight: </b>(199 g 6.9 oz)<br><br>Made in USA.",text logo t-shirt text logo t-shirt tell classic story one word printed pure organic cotton pvc- phthalate-free ink shirt ringspun softness durable taped shoulder seam minimize chafing recyclable common thread recycling program.details ringspun yarn softer hand taped shoulder seam screen-print ink pvc- phthalate-freefabric .-oz organic cotton recyclable common thread recycling programweight g oz made usa
138,139,"The more you know t-shirt - Inspired by Thoreau's immortal words, Yvon Chouinard's mantra of ""the more you know the less you need"" is simply stated through the original artwork of Geoff McFetridge. The More You Know T-Shirt is printed on organic cotton (100%) using PVC- and phthalate-free inks. Durable, taped shoulder seams and ringspun fabric yarns are soft next-to-skin. Recyclable through the Common Threads Recycling Program.<br><br><b>Details:</b><ul> <li>Ringspun yarns for a softer hand</li> <li>Taped shoulder seams</li> <li>Screen-print inks are PVC- and phthalate-free</li></ul><br><br><b>Fabric: </b>4.4-oz 100% organic cotton. Recyclable through the Common Threads Recycling Program<br><br><b>Weight: </b>(150 g 5.2 oz)<br><br>Made in USA.",know t-shirt inspired thoreau 's immortal word yvon chouinard 's mantra `` know le need '' simply stated original artwork geoff mcfetridge know t-shirt printed organic cotton using pvc- phthalate-free ink durable taped shoulder seam ringspun fabric yarn soft next-to-skin recyclable common thread recycling program.details ringspun yarn softer hand taped shoulder seam screen-print ink pvc- phthalate-freefabric .-oz organic cotton recyclable common thread recycling programweight g oz made usa
139,140,"Three trees shirt - A summertime staple for airy crags and lofty topouts. The lightweight 100% organic cotton ripstop fabric adds durability for coarse climbs; it has a progressive-minded look with an ultrasoft feel. A shoulder yoke design keeps seams away from gear sling pressure points, and the drop-tail hem stays put under a harness. Three trees are embroidered on the backside of the left shoulder. Recyclable through the Common Threads Recycling Program.<br><br><b>Details:</b><ul> <li>""Soft, lightweight breathable organic cotton ripstop""</li> <li>Drop-in chest pockets</li> <li>Unique embroidery of trees on back left shoulder along yoke</li> <li>Drop-tail hem</li></ul><br><br><b>Fabric: </b>3.7-oz 100% organic cotton ripstop. Recyclable through the Common Threads Recycling Program<br><br><b>Weight: </b>192 g (6.8 oz)<br><br>Made in Thailand.",three tree shirt summertime staple airy crag lofty topouts lightweight organic cotton ripstop fabric add durability coarse climb progressive-minded look ultrasoft feel shoulder yoke design keep seam away gear sling pressure point drop-tail hem stay put harness three tree embroidered backside left shoulder recyclable common thread recycling program.details `` soft lightweight breathable organic cotton ripstop '' drop-in chest pocket unique embroidery tree back left shoulder along yoke drop-tail hemfabric .-oz organic cotton ripstop recyclable common thread recycling programweight g oz made thailand
