,id,description,preproc_description
249,250,"Simply organic tee - The Simply Organic Tee survives tough scrapes year after year, making it a perennial favorite. Made from soft organic cotton, the shirt layers beautifully and has form-flattering features like feminine crewneck styling and cap sleeves cut on the bias for great fit - all of which set it apart from the standard T-shirt crowd. Recyclable through the Common Threads Recycling Program.<br><br><b>Details:</b><ul> <li>Organic cotton jersey</li> <li>Bias-cut for drape and contouring</li> <li>Overlock stitching at neck and arm holes for added appeal</li></ul><br><br><b>Fabric: </b>4.5-oz 100% organic cotton jersey. Recyclable through the Common Threads Recycling Program<br><br><b>Weight: </b>(115 g 4 oz)<br><br>Made in Thailand.",simply organic tee simply organic tee survives tough scrape year year making perennial favorite made soft organic cotton shirt layer beautifully form-flattering feature like feminine crewneck styling cap sleeve cut bias great fit set apart standard t-shirt crowd recyclable common thread recycling program.details organic cotton jersey bias-cut drape contouring overlock stitching neck arm hole added appealfabric .-oz organic cotton jersey recyclable common thread recycling programweight g oz made thailand
250,251,"Simply organic top - When Spring's first blossoms cover the hills, venture out in the lively Simply Organic Top.  The scoop-necked shirt is made from 100% organic cotton jersey and is bias cut for drape and contouring. Its three-quarter-length sleeves have cuff vents for mobility; overlock stitching at neck and arm holes add appeal. Recyclable through the Common Threads Recycling Program.<br><br><b>Details:</b><ul> <li>Organic cotton jersey</li> <li>Bias-cut for drape and contouring</li> <li>Overlock stitching at neck and arm holes for added appeal</li> <li>3/4-length sleeves with cuff vent for mobility</li></ul><br><br><b>Fabric: </b>4.5-oz 100% organic cotton jersey. Recyclable through the Common Threads Recycling Program<br><br><b>Weight: </b>144 g (5.1 oz)<br><br>Made in Thailand.",simply organic top spring 's first blossom cover hill venture lively simply organic top scoop-necked shirt made organic cotton jersey bias cut drape contouring three-quarter-length sleeve cuff vent mobility overlock stitching neck arm hole add appeal recyclable common thread recycling program.details organic cotton jersey bias-cut drape contouring overlock stitching neck arm hole added appeal /-length sleeve cuff vent mobilityfabric .-oz organic cotton jersey recyclable common thread recycling programweight g oz made thailand
251,252,"Solid boucau halter top - The Boucau has soft ties at the neck and back that adjust for a personalized fit. A wide underbust band offers ample support; contouring darts add shape. With removable soft pads and a smooth lining for a clean look. Made from a blend of 82% nylon/18% spandex.<br><br><b>Details:</b><ul> <li>Soft ties around neck and back</li> <li>Lined front</li> <li>""Wide, elastic supportive band under bust""</li> <li>Contouring darts add shape</li> <li>""Removable, side-entry soft cups""</li> <li>Improved fabric</li></ul><br><br><b>Fabric: </b>5.6-oz 82% nylon/18% spandex<br><br><b>Weight: </b>(57 g 2 oz)<br><br>Made in USA.",solid boucau halter top boucau soft tie neck back adjust personalized fit wide underbust band offer ample support contouring dart add shape removable soft pad smooth lining clean look made blend nylon/ spandex.details soft tie around neck back lined front `` wide elastic supportive band bust '' contouring dart add shape `` removable side-entry soft cup '' improved fabricfabric .-oz nylon/ spandexweight g oz made usa
252,253,"Solid kupala top - Our fixed triangle bikini top, the Kupala, has adjustable crossover ties that cinch down and keep it all together under pressure. Small pleats add shaping. The lined front has removable soft pads. Made from a durable blend of 82% nylon/18% spandex.<br><br><b>Details:</b><ul> <li>Fixed triangle swim top with adjustable ties that crossover at back</li> <li>Lined front</li> <li>Center pleats add shape</li> <li>""Removable, side-entry soft cups""</li></ul><br><br><b>Fabric: </b>5.6-oz 82% nylon/18% spandex<br><br><b>Weight: </b>(57 g 2 oz)<br><br>Made in USA.",solid kupala top fixed triangle bikini top kupala adjustable crossover tie cinch keep together pressure small pleat add shaping lined front removable soft pad made durable blend nylon/ spandex.details fixed triangle swim top adjustable tie crossover back lined front center pleat add shape `` removable side-entry soft cup '' fabric .-oz nylon/ spandexweight g oz made usa
253,254,"Solid paries btm - The boy-short-style Paries Bottoms fit low and straight across the hips. With wide sides for comfort, a lined front and full seat coverage. Made from our improved fabric blend of 82% nylon/18% spandex.<br><br><b>Details:</b><ul> <li>Boy-short style</li> <li>Lined front</li> <li>Fits low and straight across hips</li> <li>Updated waist styling</li> <li>Medium coverage in front; full back coverage</li> <li>Improved fabric</li></ul><br><br><b>Fabric: </b>5.6-oz 82% nylon/18% spandex<br><br><b>Weight: </b>(54 g 1.9 oz)<br><br>Made in USA.",solid paries btm boy-short-style paries bottom fit low straight across hip wide side comfort lined front full seat coverage made improved fabric blend nylon/ spandex.details boy-short style lined front fit low straight across hip updated waist styling medium coverage front full back coverage improved fabricfabric .-oz nylon/ spandexweight g oz made usa
254,255,"Solid sunamee btm - Stay-put Sunamees fit straight across the hips, with full coverage in back. Lined front. Made from a formfitting blend of 82% nylon/18% spandex.<br><br><b>Details:</b><ul> <li>Full coverage</li> <li>Lined front</li> <li>Fits straight across hips</li> <li>Regular rise</li> <li>Improved fabric</li></ul><br><br><b>Fabric: </b>5.6-oz 82% nylon/18% spandex<br><br><b>Weight: </b>(43 g 1.5 oz)<br><br>Made in USA.",solid sunamee btm stay-put sunamees fit straight across hip full coverage back lined front made formfitting blend nylon/ spandex.details full coverage lined front fit straight across hip regular rise improved fabricfabric .-oz nylon/ spandexweight g oz made usa
255,256,"Solimar skirt - The Solimar is a brief and sassy wrap skirt with built-in shorts; just enough skirt for school, just enough short for recess. The ultralight, tightly woven nylon stretch fabric blocks UV rays (30 UPF) and has a DWR (durable water repellent) finish to repel water. The shorts have an interior center-front zip while the skirt wraps over with button closures - one on the inside and one on the outside. The cleanly finished skirt has welted front patch pockets and a thigh mini drop-in pocket. Waist-to-hem length is 16"" (size 8); built-in shorts inseam is 3"". Recyclable through the Common Threads Recycling Program.<br><br><b>Details:</b><ul> <li>Lightweight stretch fabric with 30-UPF sun protection and DWR (durable water repellent) finish</li> <li>Wrap skirt with built-in shorts</li> <li>Shorts have zip fly with slide closure; skirt wraps closed with 2 buttons</li> <li>Patch front pockets with welt openings; mini drop-in pocket on right thigh</li> <li>Back dart for shaping</li> <li>""Length 16"""" from waist to hem; shorts 3"""" inseam""</li></ul><br><br><b>Fabric: </b>3-oz 93% nylon/7% spandex with 30-UPF sun protection. Recyclable through the Common Threads Recycling Program<br><br><b>Weight: </b>(222 g 7.7 oz)<br><br>Made in Vietnam.",solimar skirt solimar brief sassy wrap skirt built-in short enough skirt school enough short recess ultralight tightly woven nylon stretch fabric block uv ray upf dwr durable water repellent finish repel water short interior center-front zip skirt wrap button closure one inside one outside cleanly finished skirt welted front patch pocket thigh mini drop-in pocket waist-to-hem length `` size built-in short inseam `` recyclable common thread recycling program.details lightweight stretch fabric -upf sun protection dwr durable water repellent finish wrap skirt built-in short short zip fly slide closure skirt wrap closed button patch front pocket welt opening mini drop-in pocket right thigh back dart shaping `` length `` '' waist hem short `` '' inseam '' fabric -oz nylon/ spandex -upf sun protection recyclable common thread recycling programweight g oz made vietnam
256,257,"Sol patrol shirt - Go ahead. Go bone fishing. Ride your horse across the Red Desert. Live like a Gila monster, but wear this shirt so you don't end up looking like one. The Sol Patrol's lustrous, quick-drying and exceptionally soft polyester is woven extra-tightly to block out UV rays (30-UPF rating). The princess seaming and yoke detail add a feminine touch with a fit that offers plenty of room for active casting and rein retrieval. Cleanly styled, the sleeves roll up and fasten with hidden snaps, shirt tabs secure with snaps, and the concealed chest pocket zips closed. With a hemostat flap. Recyclable through the Common Threads Recycling Program.<br><br><b>Details:</b><ul> <li>""Quick-drying polyester with tight weave is exceptionally soft and light, with 30-UPF rating for sun protection""</li> <li>Hidden zippered chest pocket</li> <li>Flattering princess seaming and yoke detail</li> <li>Roll-up sleeve with fastener</li> <li>Hemostat flap</li></ul><br><br><b>Fabric: </b>2.2-oz 100% polyester ripstop with 30-UPF sun protection. Recyclable through the Common Threads Recycling Program<br><br><b>Weight: </b>(152 g 5.3 oz)<br><br>Made in Vietnam.",sol patrol shirt go ahead go bone fishing ride horse across red desert live like gila monster wear shirt n't end looking like one sol patrol 's lustrous quick-drying exceptionally soft polyester woven extra-tightly block uv ray -upf rating princess seaming yoke detail add feminine touch fit offer plenty room active casting rein retrieval cleanly styled sleeve roll fasten hidden snap shirt tab secure snap concealed chest pocket zip closed hemostat flap recyclable common thread recycling program.details `` quick-drying polyester tight weave exceptionally soft light -upf rating sun protection '' hidden zippered chest pocket flattering princess seaming yoke detail roll-up sleeve fastener hemostat flapfabric .-oz polyester ripstop -upf sun protection recyclable common thread recycling programweight g oz made vietnam
257,258,"Sport top - The loose, performance fit of the Women's Sport Top won't hike up or become annoyingly shifty during long-distance trail mileage. The extra-long, seamless racerback tank has a looser silhouette that increases airflow and eliminates hem migration. A comfortable built-in sports bra manages high impact activities; nylon/spandex (94%/6%) fabric blend provides moisture-wicking performance.<br><br><b>Details:</b><ul> <li>Supersoft nylon/spandex blend for next-to-skin comfort</li> <li>Seamless construction</li> <li>360-degree built-in sports bra</li> <li>""Perfect length for pairing with running shorts, yoga pants or everyday styles""</li></ul><br><br><b>Fabric: </b>Tank: 9.5-oz 94% nylon/6% spandex. Built-in sports bra: 9.5-oz 94% nylon/6% spandex. Both with moisture-wicking performance<br><br><b>Weight: </b>144 g (5.1 oz)<br><br>Made in Israel.",sport top loose performance fit woman 's sport top wo n't hike become annoyingly shifty long-distance trail mileage extra-long seamless racerback tank looser silhouette increase airflow eliminates hem migration comfortable built-in sport bra manages high impact activity nylon/spandex fabric blend provides moisture-wicking performance.details supersoft nylon/spandex blend next-to-skin comfort seamless construction -degree built-in sport bra `` perfect length pairing running short yoga pant everyday style '' fabric tank .-oz nylon/ spandex built-in sport bra .-oz nylon/ spandex moisture-wicking performanceweight g oz made israel
258,259,"Meridian board shorts - The stretchy Meridian Board Shorts accommodate floaters and drop-knee bottom-turns the globe over. The wide waistband has a snap fly with tie closure, and the 93% polyester (100% recycled)/7% spandex blend won't snag, chafe or bunch up during long paddles beyond the kelp forest. A back security pocket with key loop and zip closure means van keys and hunks of wax won't get lost in the spin cycle. Inseam (size 8) is 6"". Recyclable through the Common Threads Recycling Program.<br><br><b>Details:</b><ul> <li>Stretch-woven all-recycled polyester and spandex fabric for maximum mobility and comfort</li> <li>Snap fly with flat tie closure for secure fit</li> <li>Zippered welted pocket on hem with drain hole and key loop</li> <li>Low rise</li> <li>""Inseam is 6""""""</li></ul><br><br><b>Fabric: </b>5.4-oz 93% all-recycled polyester/7% spandex. Recyclable through the Common Threads Recycling Program<br><br><b>Weight: </b>(135 g 4.7 oz)<br><br>Made in Vietnam.",meridian board short stretchy meridian board short accommodate floater drop-knee bottom-turns globe wide waistband snap fly tie closure polyester recycled spandex blend wo n't snag chafe bunch long paddle beyond kelp forest back security pocket key loop zip closure mean van key hunk wax wo n't get lost spin cycle inseam size `` recyclable common thread recycling program.details stretch-woven all-recycled polyester spandex fabric maximum mobility comfort snap fly flat tie closure secure fit zippered welted pocket hem drain hole key loop low rise `` inseam `` '' '' fabric .-oz all-recycled polyester/ spandex recyclable common thread recycling programweight g oz made vietnam
259,260,"Merino 1 crew - Our lightest merino layer, this silky-soft yet highly durable jersey-knit is made with 63% merino wool spun around an all-recycled polyester (37%) core. Super-comfortable on its own in warm temperatures or beneath layers in cooler ones, it offers great technical performance: naturally resisting odor, moving moisture away from the skin and improving dry times, regulating body temperature, and maintaining a consistent stretch. The neck - with a smooth self-fabric binding - invites ventilation but still covers a bra. We slow-wash our merino for next-to-skin softness. Machine-wash cold; lay flat to dry. Recyclable through the Common Threads Recycling Program.<br><br><b>Details:</b><ul> <li>""Slow-washed merino wool resists odor naturally, insulates even when wet, is durable, stretches and provides superior performance and softness""</li> <li>16.5 micron-gauge yarn and jersey-knit construction for luxurious hand</li> <li>""All-recycled polyester core wicks moisture, while wool next to skin controls odor""</li> <li>Softly scooped neckline ventilates while still covering bra</li> <li>Self-fabric neck binding for comfort</li> <li>Straight hem</li> <li>""Machine-wash cold, lay flat to dry""</li></ul><br><br><b>Fabric: </b>3.2-oz (108-g) 63% 16.5 micron chlorine-free merino wool/37% all-recycled polyester. Recyclable through the Common Threads Recycling Program<br><br><b>Weight: </b>(95 g 3.3 oz)<br><br>Made in USA.",merino crew lightest merino layer silky-soft yet highly durable jersey-knit made merino wool spun around all-recycled polyester core super-comfortable warm temperature beneath layer cooler one offer great technical performance naturally resisting odor moving moisture away skin improving dry time regulating body temperature maintaining consistent stretch neck smooth self-fabric binding invite ventilation still cover bra slow-wash merino next-to-skin softness machine-wash cold lay flat dry recyclable common thread recycling program.details `` slow-washed merino wool resists odor naturally insulates even wet durable stretch provides superior performance softness '' micron-gauge yarn jersey-knit construction luxurious hand `` all-recycled polyester core wick moisture wool next skin control odor '' softly scooped neckline ventilates still covering bra self-fabric neck binding comfort straight hem `` machine-wash cold lay flat dry '' fabric .-oz -g micron chlorine-free merino wool/ all-recycled polyester recyclable common thread recycling programweight g oz made usa
260,261,"Print paries btm - Styled like a boy short, our Paries Bottoms fit low and straight across the hips, with medium coverage in front and full coverage in back. Lined front. Made from our improved fabric blend of 82% nylon/18% spandex.<br><br><b>Details:</b><ul> <li>Boy-short style</li> <li>Lined front</li> <li>Fits low and straight across hips</li> <li>Updated waist styling</li> <li>Medium coverage in front; full back coverage</li> <li>Improved fabric</li></ul><br><br><b>Fabric: </b>5.6-oz 82% nylon/18% spandex<br><br><b>Weight: </b>(54 g 1.9 oz)<br><br>Made in USA.",print paries btm styled like boy short paries bottom fit low straight across hip medium coverage front full coverage back lined front made improved fabric blend nylon/ spandex.details boy-short style lined front fit low straight across hip updated waist styling medium coverage front full back coverage improved fabricfabric .-oz nylon/ spandexweight g oz made usa
261,262,"Print sunamee btm - Stay-put Sunamees fit straight across the hips, with full coverage in back. Lined front. Made from a formfitting blend of 82% nylon/18% spandex.<br><br><b>Details:</b><ul> <li>Full coverage</li> <li>Lined front</li> <li>Fits straight across hips</li> <li>Regular rise</li> <li>Improved fabric</li></ul><br><br><b>Fabric: </b>5.6-oz 82% nylon/18% spandex<br><br><b>Weight: </b>(43 g 1.5 oz)<br><br>Made in USA.",print sunamee btm stay-put sunamees fit straight across hip full coverage back lined front made formfitting blend nylon/ spandex.details full coverage lined front fit straight across hip regular rise improved fabricfabric .-oz nylon/ spandexweight g oz made usa
262,263,"R1 full-zip jkt - It stretches, breathes, wicks and warms - no wonder so many serious trail and mountain athletes use and abuse our R1. And now it's even more versatile, with a full-zip front making it easier to use for everything from a midlayer in winter to a lightweight jacket on early spring mornings and alpine summer evenings. The high/low interior grid polyester enhances compressibility, airflow, insulation and dry time, and the jersey microfiber face allows smooth layering. Two zippered handwarmer pockets sit above the harness line and have glued-in (no seams) internal mesh pocket bags. Recyclable through the Common Threads Recycling Program.<br><br><b>Details:</b><ul> <li>""Versatile R1 fleece provides excellent stretch, warmth, wicking and breathability in a variety of temperatures""</li> <li>""High/low interior grid-structure enhances compressibility, airflow and dry time""</li> <li>Jersey microfiber face allows nonbinding layering</li> <li>Center-front zipper</li> <li>Handwarmer pockets</li></ul><br><br><b>Fabric: </b>R1: 6.5-oz Polartec Power Dry 93% polyester (60% recycled)/7% spandex. Recyclable through the Common Threads Recycling Program<br><br><b>Weight: </b>317 g (11.2 oz)<br><br>Made in Colombia.",r full-zip jkt stretch breathes wick warms wonder many serious trail mountain athlete use abuse r. 's even versatile full-zip front making easier use everything midlayer winter lightweight jacket early spring morning alpine summer evening high/low interior grid polyester enhances compressibility airflow insulation dry time jersey microfiber face allows smooth layering two zippered handwarmer pocket sit harness line glued-in seam internal mesh pocket bag recyclable common thread recycling program.details `` versatile r fleece provides excellent stretch warmth wicking breathability variety temperature '' `` high/low interior grid-structure enhances compressibility airflow dry time '' jersey microfiber face allows nonbinding layering center-front zipper handwarmer pocketsfabric r .-oz polartec power dry polyester recycled spandex recyclable common thread recycling programweight g oz made colombia
263,264,"R1 p/o - Here's to trails that circle the globe and to never-ending hand cracks. And here's to staying mobile, comfortable and warm with the R1 Pullover's high/low grid polyester that stretches, breathes, moves moisture, and insulates. Sized to accommodate light underlayers, it works as a stand-alone top or as a light midlayer. Recyclable through the Common Threads Recycling Program.<br><br><b>Details:</b><ul> <li>""Recycled polyester R1 fabric provides excellent stretch, warmth, wicking and breathability in a variety of temperatures, whether worn as lightweight insulation or a thermal baselayer""</li> <li>Lightweight yarns wick moisture</li> <li>Outer microfiber yarns speed evaporation</li> <li>Interior grid enhances compressibility and airflow</li> <li>""Jersey microfiber face for low-friction, nonbinding layering""</li></ul><br><br><b>Fabric: </b>R1: 6.5-oz Polartec Power Dry 93% polyester (60% recycled)/7% spandex. Recyclable through the Common Threads Recycling Program<br><br><b>Weight: </b>257 g (9.1 oz)<br><br>Made in Colombia.",r p/o 's trail circle globe never-ending hand crack 's staying mobile comfortable warm r pullover 's high/low grid polyester stretch breathes move moisture insulates sized accommodate light underlayers work stand-alone top light midlayer recyclable common thread recycling program.details `` recycled polyester r fabric provides excellent stretch warmth wicking breathability variety temperature whether worn lightweight insulation thermal baselayer '' lightweight yarn wick moisture outer microfiber yarn speed evaporation interior grid enhances compressibility airflow `` jersey microfiber face low-friction nonbinding layering '' fabric r .-oz polartec power dry polyester recycled spandex recyclable common thread recycling programweight g oz made colombia
264,265,"Merino 1 t-shirt - So soft it's worth lingering in, our lightest merino layer is made with 63% merino wool spun around an all-recycled polyester (37%) core. Super-comfortable on its own in warm temperatures or beneath layers in cooler ones, this silky yet highly durable jersey-knit offers great technical performance: naturally resisting odor, moving moisture away from the skin and improving dry times, regulating body temperature, and maintaining a consistent stretch. The neck - with a smooth self-fabric binding - invites ventilation but still covers a bra. We slow-wash our merino for next-to-skin softness. Machine-wash cold; lay flat to dry. Recyclable through the Common Threads Recycling Program.<br><br><b>Details:</b><ul> <li>""Slow-washed merino wool resists odor naturally, insulates even when wet, is durable, stretches and provides superior performance and softness""</li> <li>16.5 micron-gauge yarn and jersey-knit construction for luxurious hand</li> <li>""All-recycled polyester core wicks moisture, while wool next to skin controls odor""</li> <li>Softly scooped neckline ventilates while still covering bra</li> <li>Self-fabric neck binding for comfort</li> <li>Straight hem</li> <li>""Machine-wash cold, lay flat to dry""</li></ul><br><br><b>Fabric: </b>3.2-oz (108-g) 63% 16.5 micron chlorine-free merino wool/37% all-recycled polyester. Recyclable through the Common Threads Recycling Program<br><br><b>Weight: </b>73 g (2.6 oz)<br><br>Made in USA.",merino t-shirt soft 's worth lingering lightest merino layer made merino wool spun around all-recycled polyester core super-comfortable warm temperature beneath layer cooler one silky yet highly durable jersey-knit offer great technical performance naturally resisting odor moving moisture away skin improving dry time regulating body temperature maintaining consistent stretch neck smooth self-fabric binding invite ventilation still cover bra slow-wash merino next-to-skin softness machine-wash cold lay flat dry recyclable common thread recycling program.details `` slow-washed merino wool resists odor naturally insulates even wet durable stretch provides superior performance softness '' micron-gauge yarn jersey-knit construction luxurious hand `` all-recycled polyester core wick moisture wool next skin control odor '' softly scooped neckline ventilates still covering bra self-fabric neck binding comfort straight hem `` machine-wash cold lay flat dry '' fabric .-oz -g micron chlorine-free merino wool/ all-recycled polyester recyclable common thread recycling programweight g oz made usa
